<?xml version="1.0" encoding="UTF-8"?>
<xs:schema xmlns:xs="http://www.w3.org/2001/XMLSchema" elementFormDefault="qualified">
  <xs:element name="patientData">
    <xs:complexType>
      <xs:sequence>
        <xs:element name="title" type="xs:string"/>
        <xs:element name="entry" minOccurs="1" maxOccurs="unbounded">
          <xs:complexType>
            <xs:sequence>
              <xs:element name="patientNo" type="xs:int"/>
              <xs:element name="patientName">
                <xs:complexType>
                  <xs:sequence>
                    <xs:element name="first" type="xs:string"/>
                    <xs:element name="middle" type="xs:string" minOccurs="0"/>
                    <xs:element name="last" type="xs:string"/>
                  </xs:sequence>
                </xs:complexType>
              </xs:element>
              <xs:element name="patientDoctorName" type="xs:string"/>
              <xs:element name="patientDisease" type="xs:string" minOccurs="1" maxOccurs="unbounded"/>
              <xs:element name="patientLabTest" type="xs:string" minOccurs="1" maxOccurs="unbounded"/>
            </xs:sequence>
          </xs:complexType>
        </xs:element>
      </xs:sequence>
    </xs:complexType>
  </xs:element>
</xs:schema>