<?xml version="1.0" encoding="UTF-8"?>
<patientData xmlns:xsi="http://www.w3.org/2001/XMLSchema-instance" xsi:noNamespaceSchemaLocation="patientData.xsd">
  <title>Patient Data</title>
    <entry>
      <patientNo>12345</patientNo>
      <patientName>
        <first>Ram</first>
        <middle>Thapa</middle>
        <last>Magar</last>
      </patientName>
      <patientDoctorName>Hari Shrestha</patientDoctorName>
      <patientDisease>Malaria</patientDisease>
      <patientLabTest>Urine Test</patientLabTest>
      <patientLabTest>Stool Test</patientLabTest>
    </entry>
    <entry>
      <patientNo>12745</patientNo>
      <patientName>
        <first>Raj</first>
        <last>Chand</last>
      </patientName>
      <patientDoctorName>Hari Shrestha</patientDoctorName>
      <patientDisease>Malaria</patientDisease>
      <patientDisease>Cancer</patientDisease>
      <patientLabTest>Urine Test</patientLabTest>
    </entry>
</patientData>